{
  "schemaVersion": "nodekit.evolution-event/v1",
  "id": "evt:submission-cli-named-options",
  "projectId": "nodekit",
  "repository": "HomenShum/node-platform",
  "source": {
    "commitSha": "d0d9bb5b0a2cde1cdc2b236025ac985595613a5d",
    "occurredAt": "2026-07-22T01:20:48-07:00"
  },
  "track": "product",
  "category": "release",
  "challenge": "The natural named-option form for selecting a submission candidate failed before evidence evaluation began.",
  "observedFailure": "npm run submission:prepare -- --candidate <sha> treated --candidate as a literal Git reference and produced a spawn error instead of a readiness manifest.",
  "resolution": "Submission preparation and evaluation now accept explicit named options, retain positional compatibility, reject unknown options clearly, and have subprocess coverage for the public command form.",
  "assumptionIds": [],
  "invariantIds": [
    "inv:submission-cli-explicit-options"
  ],
  "evidenceIds": [
    "evd:submission-cli-explicit-options"
  ],
  "predecessorIds": [
    "evt:exact-candidate-contract"
  ],
  "knownLimitations": [
    "A generated readiness manifest remains fail-closed until every external evidence gate passes.",
    "This change improves command usability but does not authorize publication or Convex submission."
  ],
  "interpretation": {
    "status": "human-reviewed",
    "reviewedBy": "project-owner",
    "reviewedAt": "2026-07-22T01:20:48-07:00"
  }
}
