{
  "schemaVersion": "nodekit.evolution-event/v1",
  "id": "evt:frontend-decisive-evidence",
  "projectId": "nodekit",
  "repository": "HomenShum/node-platform",
  "source": {
    "commitSha": "f4bf70f5356c913aa3d7f28fab83ccba3f94877c",
    "occurredAt": "2026-07-23T05:30:00-07:00"
  },
  "track": "harness",
  "category": "evaluation",
  "challenge": "The frontend tournament could print TOURNAMENT DECISIVE from booleans the candidate wrote into its own benchmark, so the NodeSlide pilot metric would have measured how cheaply an agent claimed to pass rather than whether a direction passed an independently observed gate.",
  "observedFailure": "decisive was browserChecksPassed && accessibilityPassed && overflowPassed && majorFindings.length === 0 over candidate-supplied fields; three true values and two empty arrays authorized the verdict with no evidence binding.",
  "resolution": "The decisive verdict is computed from a Frontend Render Contract. A verifier-authored render receipt over the six required states, whose check statuses are derived from raw observations, plus an independent review receipt bound to the same state manifest, are graded DECISIVE / NOT_DECISIVE / FAIL / INCOMPLETE / UNVERIFIED; only DECISIVE authorizes. The benchmark schema dropped the three candidate booleans. A corruption corpus proves each self-attested shortcut lands on the correct graded verdict.",
  "assumptionIds": [
    "asm:structural-browser-proof-sufficient"
  ],
  "invariantIds": [
    "inv:major-frontend-direction-tournament"
  ],
  "evidenceIds": [
    "evd:frontend-decisive-evidence"
  ],
  "knownLimitations": [
    "The verifier command that drives a real browser over the six states and calls the assembler is not yet wired; receipts are assembled from observations, not from a live browser run.",
    "Freezing a new tournament version so a benchmark cannot be replayed against a stale contract is a separate follow-on.",
    "This makes the tournament's decisiveness honest; it does not by itself certify any real frontend, model, or consumer."
  ],
  "interpretation": {
    "status": "human-reviewed",
    "reviewedBy": "project-owner",
    "reviewedAt": "2026-07-23T06:45:00-07:00"
  }
}
