{
  "schemaVersion": "nodekit.evolution-event/v1",
  "id": "evt:builder-journey-j0",
  "projectId": "nodekit",
  "repository": "HomenShum/node-platform",
  "source": {
    "commitSha": "8325be69ee42c66ddc940f405e2bb0b3fe91e197",
    "occurredAt": "2026-07-23T06:15:00-07:00"
  },
  "track": "product",
  "category": "workflow",
  "challenge": "NodeKit had powerful engines but no coherent vehicle carrying a builder from an idea to a live, improving product, and its worst seam let the coding agent make product decisions while coding, so strong technical work still shipped the wrong interface.",
  "observedFailure": "There was no object sequencing the stages, and no approved boundary the coding agent had to build against; scope was re-decided during implementation.",
  "resolution": "Added the Builder Journey J0: nodekit.builder-case/v1 carries one venture through DECIDE to BUILD to EXPLAIN to LAUNCH to LEARN with one handoff artifact and receipt per stage, reusing Caseflow. nodekit.opportunity-contract/v1 is the Decide handoff that records the user, problem, wedge, primary job, inputs, primary artifact, rejected alternatives, open unknowns, success condition, and authority limits, so scope cannot be re-decided while coding. advanceStage is fail-closed: it blocks unless the stage's handoff artifact and a receipt exist and the receipt binds that artifact by content hash.",
  "assumptionIds": [
    "asm:domain-preset-harmless"
  ],
  "invariantIds": [
    "inv:builder-journey-stage-handoff"
  ],
  "evidenceIds": [
    "evd:builder-journey-j0"
  ],
  "knownLimitations": [
    "Only the Decide to Build seam has a real handoff contract; the other four handoff artifacts are named and referenced but not yet given schemas or generators.",
    "The builder journey is a contract and a fail-closed advance rule, not yet a running product surface, and no real builder has carried a case end to end.",
    "The salon slice is a fixture, not a certified application; the EASE verdict remains EASE_NOT_CERTIFIED."
  ],
  "interpretation": {
    "status": "human-reviewed",
    "reviewedBy": "project-owner",
    "reviewedAt": "2026-07-23T06:45:00-07:00"
  }
}
